[
  {
    "event_id": "MON-DEMO-001",
    "facility_id": "FAC-DEMO-002",
    "monitoring_location_id": "OUTFALL-001",
    "observed_at": "2026-09-21T14:30:00Z",
    "medium": "wastewater",
    "collection_method": "lab_analysis",
    "parameters": [
      {
        "parameter_name": "BOD",
        "value": 18.4,
        "unit": "mg/L",
        "method": "Demo Lab Method",
        "quality_flag": "valid",
        "threshold": {
          "limit": 30,
          "unit": "mg/L",
          "comparison": "less_than_or_equal",
          "exceeded": false
        }
      },
      {
        "parameter_name": "TSS",
        "value": 21.7,
        "unit": "mg/L",
        "method": "Demo Lab Method",
        "quality_flag": "valid",
        "threshold": {
          "limit": 30,
          "unit": "mg/L",
          "comparison": "less_than_or_equal",
          "exceeded": false
        }
      }
    ],
    "location": {
      "latitude": 38.9019,
      "longitude": -77.0461,
      "description": "Demo final effluent outfall"
    },
    "metadata": {
      "submitted_by": "demo_operator",
      "review_status": "submitted",
      "source_system": "demo_monitoring_portal",
      "created_at": "2026-09-22T12:00:00Z"
    }
  }
]
